content,score
"Sangat seru, banyak journal journal keren yang bisa kita isi. bahasa di aplikasi juga sangat ringan sehingga kita merasa seperti sedang mengobrol dengan teman.",5
Saya kira mental saya butuh penanganan. Saat saya mencoba untuk mencari penanganan di aplikasi ini saya sadar bahwa penanganan itu butuh duit. So mungkin bertahan beberapa tahun lagi untuk mendapatkan penanganan mental saya. Terimakasih udah bikin apk inj,5
"Aplikasinya sangat membantu saya,di dalam aplikasi ini banyak ilmu yang bermanfaat,tampilan dari aplikasi yang menarik,banyaknya pilihan yang bisa saya pilih,dan kenyamanan saya saat menggunakan aplikasi ini.",5
Aplikasi yang dapat membantu dalam menjaga kesehatan mental dan memperbaiki kesehatan mental,5
"Aplikasi ini sangat bagus,saya ingin berterimakasiih yg banyak riliv sudah membantu menemani masa masa sulit saya",5
Sejauh ini membantu. Semoga bisa selalu menemani dan membuat kesehatan mental membaik,5
"Bagus banget banget bangett, semua orang yang pengen membentuk kebiasaan baru terutama dalam mendisiplinkan diri dan menjaga kesehatan mental butuh iniii agar lebih terarah. Makasih ya tim yang buat app ini dgn segala fitur nya yg keren dan fungsional❤️❤️",5
"Fiturnya banyak, aplikasi mudah di pahami, tampilan menarik, banyak firtur yang sangat membantu dan banyak fitur yg bisa di eksplore setiap hari nya. Membantu saya mengatasi kecemasan pada diri saya",5
Aplikasi nya membantu aku dalam menjalankan kehidupan dan memperbaiki diri terima kasih Riliv,5
"Aplikasinya bagus sekali, bener2 ngebantu menguraikan kerumitan yang ada di kepala, tapi mungkin bisa ditingkatkan lagi agar loading di apps nya bisa cepat seperti aplikasi lain, karena di HP saya butuh 3-5 detik untuk menunggu loading ntah itu gambar atau transisi pertanyaan di jurnal, walau begitu masih bagus kok, semangatt dan terimakasih",5
Sangat membantu kita melupakan permasalahan yg dialami dalam kehidupan sehari-hari,5
"Tampilan aplikasinya simpel dan mudah dipahami, fiturnya sangat lengkap,sesi meditasi dan cerita sebelum tidur nya sangat menenangkan,sesi konselingnya juga sangat sangat terjangkau harganya dan dapat membantu.Keren",5
"Aplikais yang sangat membantu, sangat mudah menggunakannya",5
Apl nya bagus sangat membantu saya yg kesulitan dan kurang apresiasi terimakasih dan jangan berubah yaa ❤️🤗,5
Aplikasi terobosan yang bagus untuk masyarakat lebih terbuka tentang kesehatan mental,5
bagusss bangett dan sangatt bermanfaatt terimakasihh pembuat aplikasi🥰🥰,5
Meskipun aplikasi tidak bisa diakses karena gadget yang tidak support tapi pihak Riliv menghubungi saya lewat line dan sesi konseling lewat WA. Terimakasih banyak sudah mendengarkan keluh kesah serta masukannya buat support untuk selalu bahagia dan menyediakan waktu untuk me time,5
"menurut saya untuk meditasi, lebih dikurangi untuk percakapan kepada pasien, agar pasilen lebih fokus untuk meditasi, jadi intinya lebih memberi kesempatan untuk meditasi lebih banyak waktu. Tetapi untuk metode Meditasi sudah bagus.",5
"Saya pribadi sangat menyukai aplikasi ini ketika rasanya malas jurnaling di buku dengan mudah saya bisa mengakses di aplikasi riliv di hp saya dimanapun dan kapanpun di tambah dengan fitur2 yg mengarahkan saya untuk menulis apa saja yg berkaitan dengan yg saya rasakan, juga meditasi saya merasa lbih tenang dan damai ketika meditasi di temani hening dari riliv pikiran saya tidak lari2 kemana mana ketika meditasi di riliv beda ketika saya melakukannya sendiri, overthinking, dan insomnia hilang!!!",5
"Aplikasinya bagus banget apalagi ada fitur meditasi yang sangat membantu meringankan kecemasan berlebihan, sangat suka. Terimakasih riliv, tapi sebaiknya diberikan fitur download meditasi jadi bisa tetap diputar walaupun sedang offline 👍",5
"Akhirnya nemu app journal yang cocok sama aku! Suka karena variatif dan gak monoton. Selain journal, meditasinya membantu sekali, Thank you riliv!",5
"Bagus bangettt aplikasinyaaa sukaa sangat membantu buat meditasi dirumah, dan meditasi nya juga bermacam2 jadi bisa di sesuaikan dengan kebutuhan kita .. makasih pengembang udah buat aplikasi ini",5
"Aplikasi yang lumayan membantu. Kode refeal buat akses konten selama 7 hari, ZACrSS. Saya akan merasa sangat senang apabila audionya dapat didownload sehingga bisa diputar secara offline, mungkin bisa dibatasi untuk penyimpanannya hanya berlaku 1-3 hari. Terima kasih riliv.",5
"Terima kasih Riliv sudah membantu mengurangi anxiety dan mood saya yg berubah-ubah :) Biasanya tiap kali fase down pasti lama bgt buat pulih, tapi baru 2-3 kali denger meditasi disini rasa sesak di dada tiap kali ada masalah sudah lumayan berkurang.. bisa untuk pengalihan juga kalo pikiran lagi gak karuan.",5
"Sangat membantu. Tapi tolong ditambahkan juga pembayaran melalui e-wallet. Supaya memudahkan kami untuk berlangganan konten meditasi dan lainnya. Terima kasih, riliv!",5
"Aku baru saja mengalami breakdown yang cukup serius setelah nggak merasakan depresi selama berbulan-bulan. Aku rasa itu karena stress dan tekanan yang bertumpuk. Belum lagi beban menyusahkan orang karena baru-baru ini aku kecelakaan dan ga bisa memakai tangan kananku dengan normal. Aku sign up untuk meditasi riliv. Baru sekali meditasi, aku langsung merasa lebih baik. Aku belum mencoba konsultasi karena belum merasa butuh, tapi aplikasi ini beneran keren. Terus berkembang riliv.",5
"selama aku pakai aplikasi ini semuanya oke oke aja ga ada masalah sama sekali , meditasi meditasi nya juga cukup ko buat aku yang ga terlalu punya banyak masalah soal diri , Membantu banget buat tenangin diri , dan ngebantu juga buat ningkatin kesadarsn diri , aku suka banget sama aplikasi ini karna cukup banyak fitur fitur yang menarikk , its really really worth it to install !! 🐰💜",5
"Aku barusan donlot main bentar trus hapus lagi. Tampilan nya aesthetic bgt. suara nya jernih renyah bgt, sopan banget masuk telinga. Aku suka tp aku uninstall krn missqueen.",5
"Sangat membantu, bahkan untuk orang yang pertama kali melakukan meditasi, serta di mudah kan dengan fitur gratis walaupun terbatas tapi memuaskan dan meyakinkan untuk beli paket yang premium🙏✨",5
"Aplikasinya sangat membantu meningkatkan rileksasi saat tidur. Rasanya sangat cepat menuju Deep Sleep, menjadi pribadi yang lebih tenang dan Baik. Jangan Lupa klik kode : oKlUxl untuk gratis voucher meditasi selama 7 hari yaa..",5
Untuk chat konseling instannya cukup membantu dan terjangkau,5
Kerenn 👍🏽 sangat bermanfaat untuk menunjang semangat aktifitas sehari hari ini untuk meditasinya.. terus saran kalau bisa meditasinya di awal saja berikan instruksi instruksi sehingga saat dipertengahan kita bisa fokus untuk melakukan meditasi . Terimakasih riliv 🙏🏾,5
"Aplikasi yang sangat membantu dalam menenangkan pikiran, I like it. Bisa buat pelajaran, pengalaman, dan lain². Aku sangat merekomendasikan aplikasi ini Tetap semangat ya^^",5
"Baru coba download seminggu,aplikasi bagus membantu saya yang insomia cepat tidur,tidur pulas,biasanya gelisah dan pelariannya hp sampai subuh,sekarang dibawah jam 12 malam sudah ngorok,bahkan nuansa hening rumah nyaman blm 45 menit sudah lelap,terima kasih ya,saya suka apalagi yang gratis😍",5
"Aplikasinya sangat membantu, mempermudah pengguna, dan jelas. Saya pengguna lama yang banyak melihat perubahan/update an pada aplikasi ini yang menjadi lebih baik dari sebelumny. Aplikasi ini selalu mendengar feedback dari pengguna. Jadi banyak perubahan yang sangat membantu pengguna aplikasi riliv. Ada banyak pemilihan/filtur yang dulu tidak ada sekarang pelan"" ada. Terima kasih sudah buat aplikasi sebagus ini, semoga selalu dipertahankan sisi baik dari aplikasi ini.",5
"Dibandingkan datang ke psikolog secara langsung, apps ini menawarkan harga yang sangat jauh lebih murah. Sangat direkomendasikan untuk kawan kawan yang membutuhkan bantuan, karena penawarannya hampir sama seperti saat anda bertemu langsung dengan psikolog, anda bisa dibantu menemukan diri anda dalam posisi yang lebih baik. Semoga apps ini bisa berkembang lebih baik lagi kedepannya, agar semua kawan yang membutuhkan bantuan, bisa dengan mudah dibantu Terima Kasih telah membuat apps ini",5
"Saya baru memulai meditasi sebanyak 2 kali. Setelah meditasi, saya merasa lebih tenang. Selain itu, jurnal di riliv juga membantu saya untuk mengungkapkan seluruh cerita yang tidak bisa saya ungkapkan kepada orang lain. Terima kasih riliv, semoga terus berkembang menjadi lebih baik tanpa mengurasi kualitas yang sebelumnya.",5
saya adalah pelajar yang belum pernah mencoba aplikasi ini.Saat mencoba sesi meditasi di riliv saya merasa pikiran dan beban hidup berkurang mungkin bisa ditambah alunan lagu yang membuat suasana meditasi lebih masuk,5
Sama persis konseling dengan psikolog. lebih efektif karena bisa kapanpun dimanapun saat dibutuhkan. tidak perlu mengatur janji untuk pertemuan. harganya juga terjangkau. semoga dapat membantu setiap org yang membutuhkan💜.,5
Terimakasih Krn udh ada apk ini...saya selalu mengalami tekanan mental yg membuat kecerdasan saya menurun sehingga saya menjadi malas untuk belajar..semoga dengan adanya apk ini saya bisa terbantu untuk tenang dan bisa fokus lagi dengan prestasi yang saya impikan selama ini.semua org pasti berbeda..klw bagi saya... sedikit kata2 yg membuat saya sakit hati. Menjadikan pikiran saya menurun drastis dalam belajar.. terima kasih byk ya!,5
"Mengurangi kecemasan, kegundahan, dan stress yang saya alami. Dengan meditasi, menulis jurnal, dan mood tracker, banyak hal yang ternyata harus saya syukuri meskipun itu berupa ujian. Banyak hal yang bisa dikendalikan, salah satunya emosi negatif, semenjak menggunakan riliv. Terima kasih riliv!",5
"aku pernah ke psikolog langsung dan harga nya mahal ini mnurut aku lumayan harga nya buat apresiasi psikolog jg. Dan malah aku lebih nyaman chat karna jadi bisa lebih detail ceritain nya daripada kalo ketemu langsung malah suka malu, bingung dan suka lupa mau critain apa. Fleksibel juga mau jam brapa. malah waktu nya lebih kaka nya tetep mau nanggepin. Kaka nya detail jg nanyain nya biar tepat nanganin permasalahan nya. cuman notif nya di hape aku suka gamuncul. semoga bisa lebih baik lagi yah",5
"sangat bagus. membantu sekali bagi yang belum pernah meditasi sebelumnya. semoga fiturnya bisa ditingkatkan. karena setelah mengetahui meditasi, cara orang berbeda2 bisa lebih banyak pilihan meditasi lagi.",5
"Halo.. ini aplikasi baru saya coba, dan baru di download udah bagus bangeeet ><. Saya menyesal baru tau aplikasi ini :"" Semoga membantu saya menghilangkan PTSD ku. Karena kalau ke psikiater saya tidak cukup biayanya pasti cukup mahal. Sekali lagi terimakasih untuk para developer yang sudah membuat aplikasi ini. Salam hangat (◍•ᴗ•◍)✧*。",5
"Aplikasinya recommended bngt gampang d gunain, efektif jga. bikin calming.trs ada fitur yg bisa nemenin tidur lbih lelap.ada yg berbayar tpi ga smua kok. Worth to try :). Good luck. You are amazing, no matter what..",5
"Saya mengikuti sesi konseling paket perkenalan. Alhamdulillah sangat membantu. Tingkat stress saya berkurang skalanya. Mba psikolog-nya juga memberikan saran2 stlh sesi berakhir, dan itu sangat membantu saya utk pulih. Terimakasih riliv.",5
"Aplikasinya membantu banget! Saya jadi lumayan rileks, nggak stress atau semurah dulu lagi, terimakasih. Btw yang baru daftar tambahin kode ku ya : qbvis4 biar bisa akses gratis 7 hari :)",5
"Aplikasi yang bagus untuk digunakan, Namun saya mempunyai masukan, yaitu pemutar audio berhenti saat layar ponsel mati (pada Samsung A50s) Terimakasih untuk perhatiannya, dan saya tunggu perbaikannya.",5
"Terimakasih Riliv dengan adanya aplikasi mengenai kesehatan jiwa dari Riliv saya semakin baik,dari semua sesi meditasi sangat nyaman digunakan serta memberikan hasil bagi kesehatan mental saya yang terganggu oleh anxiety disolder..",5
Sejauh ini pengalamannya menyenangkan. Sangat membantu mengurai isi hati yang kadang tidak bisa kita cerna jika dilakukan sendirian. Dengan fitur journal dari aplikasi riliv aku merasa banyak terbantu.,5
"Karena saya baru mendownload dan juga melihat fitur dari riliv, saya berpendapat bahwa ini akan cukup membantu saya dikesehatan mental saya dan managemen diri dengan baik melalui fitur journal ,journey",5
"Gue suka banget aplikasi ini sangat membantu untuk meditasi dan ada bsnyak sekali pilihan sesuai kondisi yang dibutuhkan, dan yang paling penting (sebagian teks hilang)",5
Aplikasi ini bagus banget cocok buat kalian yang butuh konsul atau meditasi. Buat kalian yang masih bingung coba deh download nanti di kasi arahan gampang bangett. Aku kasi bintang 5 karena emang sebagus itu Setelah download aplikasi ini tidurku lebih nyenyak ga sering overthinking dan lebih relax :) Terimakasih,5
"Terima kasih, Riliv! Saya bisa lebih segar nyaman dan tenang berkat aplikasi ini! Aplikasinya sangat membantu untuk kesehatan mental. Disini juga bisa meditasi dan konseling.",5
"Aplikasi ini sangat berguna bagi saya, karena bisa membimbing saya untuk bermeditasi sejenak dan 'curhat' dengan psikolog. Apalagi disaat kondisi seperti sekarang, aplikasi ini sangat membantu dalam manajemen stress kepada saya yg termasuk tim medis di rumah sakit. Terimakasih.",5
Hai kak oliv. Mau nanya kak. Kan aku udh langganan riliv utk 2 bulan trs mau download konten2 di riliv biar nanti lebih hemat data. Itu nanti makek penyimpanan internal atau penyimpanan kartu sd ya kak utk konten2 yg telah didownload?,5
"dri segi tampilan dan fitur sgt baik trs cara pakainya jg gampang dan ada bbrp fitur yg cmn ada di sini, buat berlangganan jg menurut ku msh tergolong murah cmn yaa metode pembayarannya msh kurang masa cmn s.pay, g.pay, trs tf bank, sama credit card jdi bsa tolong ditambah lgi seperti apk d4n4 yg udh umum digunain kn kasian yg g punya credit card 😊 rekomended 9,5/10",5
"worth it banget aplikasi ini, jujur sangat bermanfaat untuk orang2 yang membutuhkan penyembuhan, ketenangan batin dan segala stes yg dirasakan yang mengganggu fikirannya. dan fasilitas disini bagus2 bgt, ada sesi meditasi sesuai kebutuhan, bisa konsultasi online, bisa bikin journey sesuai isi hati...dll aaa beruntung banget kenal aplikasi riliv 🥰❤✨ thanksss rilivvv",5
"Banyak fitur yg bisa membantu kita. Aplikasinya user friendly dan sering melakukan pembaruan❤️ Ada banyak sekali pilihan jenis meditasi yg disesuaikan dg permasalahan yg kita miliki. Ini aplikasi yg sangat bagus, walau masih pengguna awal, udah keliatan kalau aplikasinya emang sebagus itu. Nggak nyesel download aplikasi ini. Terima kasih karena sudah eksis, Riliv💕",5
"Sangat sangat membantu saya yang sering sekali overthinking. Dengan waktu yang singkat, pikiran dan mental saya sudah sangat rileks, dan itu mempengaruhi kondisi fisik saya. Sepadan dengan biaya yang saya keluarkan.",5
"Aplikasi yang amat sangat bagus dan sangat membantu, apalagi meditasinya. Baru awal tapi saya sudah merasa sangat rileks dan tubuh saya terasa sangat nyaman. Ohiya untuk kalian pengguna baru bisa pakai kode referral untuk meditasi gratis selama 7 hari kodenya : Idtsue",5
"Bagus banget aplikasi ini, beneran diajarin meditasi dari nol pake audio ahli mediator yang bikin tenang banget, coba deh aplikasi ini bener bener bagus, saya yakin hidup saya jadi lebih baik lagi setelah tau meditasi",5
"Aplikasi nya bagus dan sangat membantu aku yang mood swing. Kemarin sempat ada kendala, lalu mention akun riliv di twt, langsung ditanggapi dan akhirnya lancar jaya kembali Saran : Konten lelap nya tolong diperbanyak",5
"Thanks banget buat development karna udh bikin apps ini. Ketika lg stress, frustasi, n emosi, apps ini membantu banget buat melepas hal-hal itu semua dr pikiran kmu.. rekomen buat kamu yg overthingking..✨✨",5
"Aplikasi ini recommended sekali untuk yang lagi ngerasa sepi atau depresi atau rasa cemas seperti saya. Mau cerita dikit nih, Jadi hari ini 11 Juni 2020 adalah hari ulang tahun ku, tapi tak ada satupun orang yang mengucapkan selamat ulang tahun padaku 😢. Aku introvert, tapi aku sangat ingin mereka tau tentangku tapi aku pun tak mau terbuka. Sedih dan sepi selalu datang menghampiri, trus aku nemuin aplikasi ini, coba meditasi dan malam ini aku merasa lebih baik. Terimakasih banyak Riliv 😊",5
"Fiks.. bagus banget aplikasi nya, apalagi untuk remaja dimana banyak hal baru yang kita rasakan aplikasi ini worth it banget untuk menemani perubahan perubahan di dunia 'remaja' , aplikasi ini bukan hanya untuk orang orang yang punya masalah a.k.a stres a.k.a depresi tapi untuk yang sedang baik baik saja aku rasa worth sih untuk pakai aplikasi ini.",5
Tampilannya sangat ramah dengan banyak fitur didalamnya. Fitur-fiturnya sangat membantu diri saya. Terimakasih.🙏😁😁,5
"Isi materinya bagus, meditasinya pun membantu bgt, jd bikini addict meditasi. Fitur tidur lelapnya asik jg trutama crita lelap, tp yaa sama, srg putus jg. Klo bs jg, tmbahin trus crita lelapnya. Edited, udah lancar app-nya skrg",5
"Terimakasih riliv saya merasa sangat terbantu dalam meregulasi emosi saya lebih baik lagii.. ini adalah aplikasi kesehatan mental terbaik yang pernah saya ketahui, tapi setelah diupdate kok ngga ada fitur pencarian di laman artikel lagii?mohon di adakan lagii agar bisa lebih memudahkan mencari topik/artikel yang sedang saya butuhkan 🙏 thks, keep grow up",5
"Bagus banget, seminggu ini aku agak lebih tenang dan ga overthinking, saran untuk kegiatan event kayak webinar gitu jadwal nya bisa dilihat juga di aplikasi jadi temen temen yang pengen nambah ilmu and diskusi bisa ikut di opsi kegiatan min hehehe, semoga semakin sukses dan makin keren aplikasinya",5
"Karna g ada bibi yg ngurus rmh, setahun ini gtw hrs curhat sma siapa. Sampe ketemu riliv, aku bisa ngeluh soal masalah sklh, family, dll (macem2 topikny). Paling suka klo pas buka riliv ditanyain ""Bagaimana perasaanmu saat ini?"". Disitu seneng bgt, cuz merasa akhirny ada yg tau feel n mood ku disaat merasa butuh. Meditasi, konseling n journalnya jg oke, thanks y riliv <3",5
"Assalamualaikum.... terima kasih riliv aplikasi ini sangat membantu banyak orang. Dan saya menyadari bahwa berkonsultasi ke psikolog itu bukan hanya mereka yang mengalami tekanan atau apapun, tetapi setiap orang perlu untuk kesehatan mental yang baik. Sehingga kita bisa lebih teratur kembali menjalani kehidupan penuh kebahagiaan. Terima kasih. Aplikasi ini bagus sekali untuk setiap orang yang peduli terhadap diri dan mentalnya 😊.Wassalamualaikum wr.wb",5
"Keren bgt aplikasi nya .. baru download,baru coba sekali .. buat ibu2 aktif seperti saya ini sangat membantu di malam hari kala kita sudah letih dengan keseharian yang itu2 aja .. semoga riliv berkembang pesat .. saya bakal recommend bgt nih ke semua temen2 ibu2 sosial saya.. 🙏👍🥰",5
"Bagus, mudah digunakan, tetapi masih ada beberapa bug mungkin kedepannya dapat diperbaiki, dan semoga lebih banyak pelajaran meditasi yang gratis 👍",5
"Saya merasa lebih lega dan tenang ketika menggunakan aplikasi untuk pertama kalinya pada saat meditasi dasar hidup menjadi lebih damai rasanya,rasa cemas pun mulai hilang pokoknya. RECOMENDED bngt buat kalian yg ingin cari ketenangan dan kedamaian.👍👍👍👍",5
Aplikasi yang bagus banget. Baru pertama kali meditasi aja udah ngaruh banget. Bener2 rileks dan tenang. Untuk konselingnya. Lumayan ko. Aku ngerasa aman konseling di riliv,5
Aku baru download aplikasi ini karena aku penasaran dan hasilnya sangat bagus..meditasi nya benar-benar membuat aku tenang dari sebelumnya..pakai kode referal aku (dKcEIG) supaya kalian bisa mendapat meditasi gratis selama 7 hari.Tingkatkan terus ya dan terima kasih 😊,5
"sangat membantu dalam self healing dari stress, kerjaan, masalah, dll. mudah di akses karena kerjasama dgn univ, tapi worthed it bgt klo langganan pribadi. thanks riliv",5
"Lengkap banget fitur-fiturnya. Cocok buat menjaga kesehatan mental kita. Agar lebih optimal pakai versi premium sih, harganya pun juga terjangkau banget. Terimakasih yang udah ciptain app ini",5
Aplikasi ini bener bener bagus si. Aku sering bgt mengalami anxiety. aku coba buat meditasi sama atur pernafasan alhamdulillah mood ku balik normal lagi,5
"Aplikasi yang sangat membantu, untuk meningkatkan kesehatan mental.. Terutama untuk ysng sedang dilanda stress..",5
"Permisi kak admin Mohon maaf & Berterimakasih nih sya sdh berlanggan dan sya sdh selesai pengobatan, nah.. maka dari itu sya menghapus apk Riliv.. karena penyimpanan hp sya hampir penuh. Namun tanpa sya sadari apk Riliv memberikan notifikasi setiap hari pd jam yg dlu sya tentukan untk meditasi. Saya kira notifikasinya bakalan hilang ketika apk Rilivnya di hapus.. eh malah ada setiap hari & selamanya. Tolong berikan saya solusi untuk menghilangkan notifikasi & kedepanya hrp di perbaiki🙏 J ⭐+1",5
"Saran aja sih, lebih baik ditambah fitur download sesi meditasinya supaya pas gak ada sinyal bisa tetep pake riliv.. Dan bisa offline juga.. Terima kasih🙂",5
Aplikasi yang sangat ngebantu banget buat pekerja kaya aku yg susah buat cari waktu luang pergi ke psikolog. Karna disini tuh kita bisa konseling dgn psikolog profesional tp waktunya fleksibel :),5
"Sangat membantu untuk lebih tenang. Saya mau tanya kenapa ya aplikasinya baru 1 kali pakai masih bisa, tapi besoknya selalu bertuliskan ""TIDAK ADA KONEKSI INTERNET"" Padahal internet saya lancar-lancar aja paket data juga masih ada kenapa ya mohon info dan bantuannya 🙏🏻 agar dengan aplikasi ini mental saya bisa sembuh 🙏🏻",5
"Aplikasi Riliv cocok untuk orang yang membutuhkan pertolongan dalam hal mental . Salah satunya meditasi , meditasi di riliv buat aku jadi relax , melepas kepenatan dan kegelisahan yang kita miliki. Aplikasi ini juga cocok untuk remaja kayak aku . Jadi kalau kalian mau dowload aplikasi riliv untuk memulihkan mental dan jiwa kalian kalian harus donwload .",5
"Terima kasih riliv, pertama ngikutin riliv di tiktok dan akhir nya tau kalau ternyata mereka punya aplikasi saya langsung download dan ternyata aplikasi nya cukup membantu.",5
"Terimakasih Riliv, pertama kali tau Riliv karena baca bukunya. Setelah itu install Aplikasinya terus beli yang premium biar bisa lebih banyak buka, dengan harga Rp. 250 Ribu dalam 1 Tahun. Manfaat yang saya peroleh lebih banyak dari uang yang saya keluarkan.. sekali lagi saya ucapkan terimakasih.",5
"Bagus banget🥺😭. Bisa memberi motivasi, bisa menenangkan pikiran. Saya sedang kesepian dan membutuhkan teman. Semua teman saya saat ini semuanya menjauh😔. Saya tidak tau harus bagaimana. Saya ingin curhat, tapi saya tidak punya teman curhat. Saya pun melihat di google aplikasi yg bisa di ajak curhat. Dan saya menemukan apk ini. Apk ini sangat membantu. Terimakasih Riliv",5
Aplikasi yang sangat membantu! Membuat tidurku lebih nyenyak dan kestabilan emosiku sedikit sedikit lebih baik Terimakasih riliv!,5
"jatuh cinta sama aplikasinya, udah lama saya pakai aplikasinya, saya selalu ikuti perkembangan riliv, sekarang makin nyaman digunakan sehari hari karna banyak fiturnya. saya udah pakai dari masih kelas 9 SMP sekarang udah 11 SMA. Terima kasih, appnya membantu mengenal dan mengelola emosi di masa remaja saya!",5
"Mau buka semua konten di riliv, ayoo gunakan referalku : 1bqO8Z Nikmati setiap konten yang menarik dan benefit banget apalagi buat kamu yang lagi butuh menenangkan dan mengheal diri sendiri sebagai pertolongan pertama kita 😆",5
Riliv membantuku mengenali diriku lebih dalam dan segala sumber masalahku. Meditasi dan jurnalnya membantuku sedikit demi sedikit untuk menenangkan pikiranku dan fokus pada tugas-tugasku,5
"Jadi yang saya rasakan saat pertama kali mencoba untuk program barunya yaitu meditasi yaitu ketenangan, relax dan menambah kefokusan kita. Bisa juga menenangkan diri mungkin yang lagi sumpek atau resah gelisah. Keren banget!!",5
Aplikasi ini bagus banget. Sering lihat di youtube orang2 dari negara lain menerapkan pembiasaan menulis diary. Dan sekarang saya mengerti manfaatnya untuk diri saya. Makasih banget buat yang bikin apk ini. Pertahankan dan semoga tambah maju.,5
"Aplikasi ini membantu banget buat kalian yg ingin relax. Aplikasi ini ada 1 sesi (10 setps) yg akan free, jika ingin unlocked kalian hanya perlu mengupgrade dengan membayar. 10Q Semangat 🌈 Have a nice day!",5
Hari ketiga download riliv. Alhamdulillah langsung langganan paket meditasi setahun. Lumayan jadi reminder dan journal saat gabisa cerita ke orang lain. Thanks founder and all staff for creating this amazing app ❤️ God bless you all,5
"BgYfcQ pake kode ini biar km bisa nikmatin promonya. Jujur sih ini aplikasi bagus banget untuk kamu yang peduli dengan kesehatan mental dirimu sendiri, aku baru pake sehari tapi udah bisa lebih tenang dengan nikmatin fitur meditasi. Terimakasih",5
"Terimakasih RILIV berkat fitur-fiturnya yg menarik dan membantu saya untuk lebih baik dalam menjaga dan mengontrol emosi yg kadang muncul tanpa sebab. Sayangnya saya belum bisa memakai fitur chat konselor, karena saya tidak punya uang 😂 semoga kedepannya aplikasi ini tetap memberi manfaat bagi penggunanya",5
Thank buat yang bikin aplikasi jadi lebih mudah mengkontrol emosi dan menghadapi kekecewaan dalam hidup. Smoga berkah buat yang bikin aplikasi ini karna sangat membantu banyak pihak termasuk saya,5
"Makasih banyak riliv.aku suka banget sama aplikasinya dan semua meditasi yg ada di riliv. Sumpah jadi relax,bawaanya besok jadi semangat jalanin aktivitas karna habis denger meditasi meditasinya❤❤❤❤",5
"Terimakasih sudah nyiptain aplikasi ini. Jadi bisa nulis tentang keluh kesah, suka duka setiap hari dan tanpa dibaca orang lain. Dan saya jadi bisa baca di lain waktu buat reminder.",5
menurut saya aplikasi ini sangat membantu kita agar lebih tenang dan menyelesaikan masalah kita saran untuk aplikasi ini alangkah baiknya meditasi dilakukan dalam kondisi diam tanpa ada suara tiba tiba,5
